year,title,composer,writer,singer,spotify_id,youtube_urL??,lyrics,theme/genre
2015,Our Singapore,Dick Lee,Dick Lee,JJ Lin,5WtMlbTDNZlbN8xZ5zfXva,https://youtu.be/-docVbsuMFU,"It isn't easy building something out of nothing 
 Especially when the road ahead’s a rocky one 
 But if we gather all our courage and conviction, 
 And hold our dream up high, 
 The challenge will be won. 
 
 CHORUS So now we look around us and we see A nation built with love by you and me A land to treasure right down to the core Our home, our heart, our Singapore. Oh-oh-oh-oh-oh-oh-oh Oh-oh-oh-oh-oh-oh-oh Oh-oh-oh-oh-oh-oh-oh Our home, our heart, our Singapore. Through many years gone by, we’ve moved ahead together We’ve built a brave new world where we could shine and grow And now we only have to look towards tomorrow To carry on the dream as far as it will go. [CHORUS] And amazing as it seems, It all started with a dream. And our dreaming isn't done ‘Cause the best is yet to come. [CHORUS] Our home, Our heart, Our dream, Our Singapore. Our Singapore.","50th anniversary.
The lyrics call for Singaporeans to ""look towards tomorrow"" and ""to carry on the dream as far as it will go"". "
2016,Tomorrow's Here Today,Don Richmond,Don Richmond,53A,6cHJBXRYMS2vCPeO2IaSKY,https://youtu.be/xUMjaFWhY1w,"Raise your head to the skies
 This is how we all begin
 See the fire in your eyes
 Feel the yearning deep within
 
 Take a leap and you will fly
 With all the wishes that you own
 Make your dreams light up the sky
 Home is where you’re not alone
 
 Pre-Chorus And our hearts will beat together Echoing what dreams may come Walking tall in any weather Time has come bang the drum Cause tomorrow's here today Chorus Dream away Take the world by the hand Cause tomorrow's here today Dream away Come let's go right away Cause tomorrow's here today Step into a brand new day Tomorrow's calling out your name When you know just who you are You can't stop you are on fire Looking up beyond the stars Fly the flag and raise it higher [Pre-Chorus] [Chorus] When we run along And we’re standing tall When we sing our song No way that we can fall Be what we want to be When we make our way Till it’s plain to see Tomorrow’s here today [Chorus]",
2017,Because it's Singapore,Lee Wei Song,Jay Lim,Jay Lim,,https://youtu.be/DI2TeyDJ7Zo,"Step by step
 Together we'll build our dreams
 Heart to heart
 Together we'll stay as one nation, undivided
 Back to back
 Together we'll brave the heat, the cold, the storms
 Hand in hand
 Together we'll grow this land that we call home
 
 Nothing in this world compares
 It's our Singaporean Life
 Everyone is family, friend and neighbour
 Living in harmony
 
 Nothing in this world compares
 To this island where it's home
 Where we love and know we'll never be alone
 Because it's Singapore (Just Believe)
 This is Singapore (We Can Be)
 Our Singapore (The world will see)
 We are Singapore
 
 [repeat]",
2018,We are Singapore remix,Charlie Lim,Charlie Lim,"Featuring Vanessa Fernandez, Aisyah Aziz, Shak’thiya Subramaniamm, THELIONCITYBOY, Joanna Dong, and ITE Show Choir",1lGjzrY3N3yfiK1fBFzCGB,https://youtu.be/__pmy8a17pM,"How many times have you heard them say;
 “The future is uncertain and everything must change”
 Well all of my worries and all of my fears
 Begin to lose their weight, when I hold you near
 
 If all that we are is what we believe
 Then I know I’ve got to be the change I want to see
 How easy we forget that everything takes time
 No, nothing's ever perfect, but I still call you mine
 
 This is my country, this is my flag
 This is my future, this is my life
 This is my family, these are my friends
 We are Singapore, Singaporeans
 
 This is my country, this is my flag
 This is my future, this is my life
 This is my family, these are my friends
 We are Singapore, Singaporeans
 
 We, the citizens of Singapore,
 pledge ourselves as one united people,
 regardless of race, language or religion,
 to build a democratic society
 based on justice and equality
 so as to achieve happiness, prosperity
 and progress for our nation.
 
 This is my country, this is my flag
 This is my future, this is my life
 This is my family, these are my friends
 We are Singapore, Singaporeans
 
 We are Singapore, we are Singapore
 We will stand together, hear the lion roar
 We are Singapore, we are Singapore
 We’re a nation strong and free forever more
 (This is my country, this is my flag) We are Singapore, we are Singapore
 (This is my future, this is my life) We will stand together, hear the lion roar
 (This is my family, these are my friends) We are Singapore, we are Singapore
 We are Singapore, Singaporeans
 We are Singapore, Singaporeans",
2000,Yellow,,,,3AJwUDP919kvQ9QcozQPxg,,,
2011,Paradise,,,,6nek1Nin9q48AVZcWs9e9D,,,
2008,Viva la vida,,,,1mea3bSkSGXuIRvnydlB5b,,,