year,title,composer,writer,singer,spotify_id,youtube_urL??,lyrics,theme/genre
1985,Stand Up for Singapore,Hugh Harrison,Hugh Harrison,,2aIkiuxUesXTGU756fBJYD,https://youtu.be/ZzS5rPaZW9w,"Stand up for Singapore, do the best you can
 Reach out for your fellow man
 You've got to make a stand
 Recognise you can play your part
 Let it come right from your heart
 Be prepared to give a little more
 Stand up, stand up for Singapore
 
 Stand up for Singapore, do it with a smile
 If you stand up for Singapore
 You'll find it all worthwhile
 Believe in yourself, you've got something to share
 So show us all you really care
 Be prepared to give a little more
 Stand up, stand up for Singapore
 
 Singapore our home and nation
 Together with determination
 Join in like we've never done before
 Stand up, stand up for Singapore","25 Years of Nation Building, 1959–1984
Patriotic and full of gusto , this is one song created to promote the idea of Nationalism. The song was part of a larger campaign conceived by advertising agency McCann-Erickson in celebration of Singapore’s 25 years of self-government.6 At the time, songs were also used by the government to promote campaigns such as Total Defence and energy-saving.

"
1986,"Count on Me, Singapore",Hugh Harrison,Hugh Harrison,Clement Chow,3dY7P7YoGU0gYMmFs1krC1,"https://www.youtube.com/watch?v=vfJCPpFTCTY 
 https://www.youtube.com/watch?v=L_a622n3v2I","We have a vision for tomorrow, just believe, just believe
 We have a goal for Singapore, we can achieve, we can achieve
 You and me, we'll do our part, stand together, heart to heart
 We're going to show the world what Singapore can be
 We can achieve, we can achieve
 
 There is something down the road that we can strive for
 We are told no dream's too bold that we can't try for
 There's a spirit in the air, it's a feeling we all share
 We're going to build a better life, for you and me
 We can achieve, we can achieve
 
 Count on me Singapore, count on me to give my best and more
 You and me, we'll do our part, stand together, heart to heart
 We're going to show the world what Singapore can be
 We can achieve, we can achieve
 
 Chorus:
 Count on me Singapore, Count on me Singapore
 Count on me to give my best and more, count on me Singapore
 
 (Repeat Chorus)
 
 Together Singapore Singapore (X 2)",A less mellow tune but the same nationalistic pride is infused in the song
1987,We are Singapore,Hugh Harrison,Hugh Harrison,"Jonathan Tan Teck Meng, Roslinda Baharudin, Robert Fernando and Anne Weerapass",0QeDK7Aow84hUKoLrZ1mvK,https://youtu.be/cts6ssZ_8mw,"There was a time when people said
 That Singapore won't make it, but we did
 There was a time when troubles seemed too much
 For us to take, but we did
 We built a nation, strong and free, reaching out together
 For peace and harmony
 
 Chorus 1:
 This is my country, this is my flag
 This is my future, this is my life
 This is my family, these are my friends
 We are Singapore, Singaporeans
 
 Singapore our homeland, it's here that we belong
 All of us united, one people marching on
 We've come so far together, our common destiny
 Singapore forever, a nation strong and free
 
 (Repeat Chorus 1)
 
 (Sung)
 We the citizens of Singapore
 Pledge ourselves as one united people
 Regardless of race, language or religion
 To build a democratic society
 Based on justice and equality
 So as to achieve happiness
 Prosperity and progress for our nation
 
 Chorus 2:
 We are Singapore, we are Singapore
 We will stand together, hear the lion roar
 We are Singapore, we are Singapore
 We're a nation strong and free forevermore
 
 (Repeat Chorus 1 & 2)
 
 We are Singapore, Singaporeans (X 2)","This song includ quotes from 1966 speech by then PM Lee kuan Yew to school principals: ""This is my country, this is my flag; this is my president, this is my future. I am going to protect it.""
http://www.nas.gov.sg/archivesonline/data/pdfdoc/lky19660829.pdf"
1990,"One People, One Nation, One Singapore",Jeremy Monteiro,"Jim Aitchison
who was also from the advertising industry and author of Mr Midnight",,0NsXuk0c78hzZkDr7UsIJ3,https://www.youtube.com/watch?v=piF_2PQSkBM,"We've built a nation with our hands
 The toil of people from a dozen lands
 Strangers when we first began, now we're Singaporean
 Let's reach out for Singapore, join our hands forevermore
 
 Chorus: One people, one nation, one Singapore That's the way that we will be forevermore Every creed and every race, has its role and has its place One people, one nation, one Singapore And when the time comes for the test Our vigilance will never rest We'll be united, hand in hand We'll show the world just where we stand And reach out for Singapore, join our hands forevermore ( Repeat Chorus x 2 )",It focused on building a nation and staying as one
1998,Home,Dick Lee,Dick Lee,Kit Chan,1vo8399T9sWFZ9vbrEcTL5,https://youtu.be/JOc1RGkBviQ,"Whenever I am feeling low
 I look around me and I know
 There's a place that will stay within me
 Wherever I may choose to go
 I will always recall the city
 Know every street and shore
 Sail down the river which brings us life
 Winding through my Singapore
 
 Chorus: This is home truly, where I know I must be Where my dreams wait for me, where that river always flows This is home surely, as my senses tell me This is where I won't be alone, for this is where I know it's home When there are troubles to go through We'll find a way to start anew There is comfort in the knowledge That home's about its people too So we'll build our dreams together Just like we've done before Just like the river which brings us life There'll always be Singapore ( Repeat Chorus ) For this is where I know it's home For this is where I know I'm home","Traditional national day songs are about nation-building, where society comes together, Home addresses the person. One of the elements that really drives Home is its lyrics and feel, which conveys homesickness.
First National Day tune that featured a mandarin version"
1999,Together,Ken Lim,Ken Lim,Evelyn Tan and Dreamz FM,6lago1vFsu3gw26lgKGtwa,https://www.youtube.com/watch?v=ppsWViFxVSQ,"Let us be together aspire to achieve
 No matter what, no matter when, working hand in hand
 Let us go the distance, reach for goals that shine
 Creating our future, with everyone in mind
 
 Together we make a difference, one voice, one destiny
 We remain undivided, our hearts in harmony
 Together we make a difference, our friends, our families
 We will share a special dream, together we feel the Singapore heartbeat
 
 Let us find in our strides, new strength to go on by
 Nothing is ever easy, we have to hold on and strive
 Let us never be afraid, if we have to change our ways
 Through the years, we'll always stay, one in every way
 
 We will share a special dream
 Together we feel the Singapore heartbeat
 Singapore heartbeat",This song is about making a difference with the people we love for Singapore. 
2000,Shine on Me,Jim Lim,Jim Lim,Mavis Hee and Jai Wahab,1PBxQWuUn6RFzsg30gNH0H,https://youtu.be/RV9JWZ2w4Q4,"The moment when I was born
 Into this world, into my home
 I recall when I was young
 Stars and Crescent shine on me
 
 In my heart lies my homeland
 I share this joy with my families and friends
 Let our strength build on and on
 Reaching out to the world
 
 Stars and Crescent shine on me
 Make us more than what we can be
 All our dreams come true
 As we all grow stronger
 
 Stars and Crescent shine on me
 Turning our hopes, into reality
 For we will always be
 Shining as one
 
 Let our hopes lead us afar
 Into the world, to be the best
 There's so much to reach out for
 Stars and Crescent shining on
 
 In my heart lies my homeland
 I share this joy with my families and friends
 Stepping out into a New World
 As we make our choices
 
 Repeat x2 Chorus 1 & 2",Song about millenium. It’s somehow saying that Singapore can make our dreams become a reality. 
2001,Where I Belong,Ken Lim,Ken Lim,Tanya Chua,0u0a0p4hWefiy09bYqzZ2A,https://www.youtube.com/watch?v=jUf-5W6AKes,"Morning comes around and I
 Can't wait to see my sunny island
 In its glorious greenery, whether rain or shine, it's still beautiful
 Bright lights shine on the streets at night
 Guiding me closer to home
 To a place where I'll be safe and warm, where I belong
 
 Friends and families by my side
 Seeing me through as I grow and learn
 Every day's experience, bitter sweet or sour
 They're still wonderful
 As they become precious memories
 They'll be kept close to my heart
 And no matter where I am I will always know, where I belong
 
 Where I belong, where I keep my heart and soul
 Where dreams come true for us
 Where we walk together hand in hand towards a future so bright
 Where I belong, where I keep my heart and soul
 Where we're one big family
 I want the whole world to know, I want to shout it out loud
 That this is where I know I belong
 
 I want the whole world to know, I want to shout it out loud
 That this is where I know I belong",less overtly nationalistic. This been imbued with a pop sensibility so as to appeal to the younger generation. the lyrics do not even mention the word “Singapore”
2002,We Will Get There,Dick Lee,Dick Lee,Stefanie Sun,5aY2Igd9adKu3AqY1w95Xm,https://www.youtube.com/watch?v=kD31os2SwUM,"Remember the days, we set out together with faith?
 Remember the times, so fine, when we thought that
 Nothing could stand in our way?
 
 Then things weren't the same
 The life that we knew had to change
 We've struggled through, the darkest storms
 We thought we couldn't tame
 
 Together we've tried, as we stood side by side
 I knew we'd build a new world
 A world of hope for ever after
 
 Deep in my heart I just know
 Right from the start, we will grow
 Look where we are, we've come so far
 And there's still a long, long way to go
 
 With all of my heart, I will care
 I'll play my part, I will share
 With family and friends, together we'll stand
 And in the end, hand in hand
 We will get there
 
 So now we begin, working together to win
 Believing in trust, it must
 Be possible to overcome anything
 
 There's so much to do, there's so much we can contribute
 By sharing just a little love
 We will start again anew
 
 So why don't we try? If we stand side by side
 I know we'll build a new world
 A world of hope for ever after
 
 Repeat Chorus 1&2 twice","little edgier than the past few songs and is forward-looking, which was the exact direction Singapore was headed to."
2003,One United People,Joshua Wan,Joshua Wan,Stefanie Sun,2h5gMUxXk3OBfOX9KS5hiX,https://youtu.be/reMGT286ix8,"One Singapore
 One people strong and free
 With One heart
 One voice
 We make our history
 We are a Rainbow of a thousand colours
 Lighting up the sky
 We share the Singapore heartbeat
 Together you and I, we are
 
 One Singapore
 One Nation strong and free
 A thousand different voices
 Sing in harmony
 We will stand together
 Together hand in hand
 As One united people
 For Singapore, my homeland
 
 My Singapore
 Our Island in the sun
 This is my homeland
 It's where my strength is from
 A rainbow of a thousand colours
 Lighting up the sky
 We build a brighter future
 Together you and I, we are
 
 One Singapore
 One Nation strong and free
 A thousand different voices
 Sing in harmony
 We will stand together
 Together hand in hand
 As One united people
 For Singapore (Singapore)
 
 One Singapore
 One Nation strong and free
 A thousand different voices
 Sing in harmony
 We will stand together
 Together hand in hand
 As One united people
 One united people
 One united people
 For Singapore, my homeland",
2004,Home remix,Dick Lee,Dick Lee,Kit Chan and JJ Lin,1vo8399T9sWFZ9vbrEcTL5,https://youtu.be/WEeMv5WONYE,"Whenever I am feeling low
 I look around me and I know
 There's a place that will stay within me
 Wherever I may choose to go
 I will always recall the city
 Know every street and shore
 Sail down the river which brings us life
 Winding through my Singapore
 This is home truly, where I know I must be
 Where my dreams wait for me, where the river always flows
 This is home surely, as my senses tell me
 This is where I won't be alone, for this is where I know it's home
 When there are troubles to go through
 We'll find a way to start anew
 There is comfort in the knowledge
 That home's about its people too
 So we'll build our dreams together
 Just like we've done before
 Just like the river which brings us life
 There'll always be Singapore
 This is home truly, where I know I must be
 Where my dreams wait for me, where the river always flows
 This is home surely, as my senses tell me
 This is where I won't be alone, for this is where I know it's home
 This is home truly, where I know I must be
 Where my dreams wait for me, where the river always flows
 This is home surely, as my senses tell me
 This is where I won't be alone, for this is where I know it's home
 For this is where I know it's home
 For this is where I know I'm home",
2005,Reach Out for the Skies,Elaine Chan,Selena Tan,Taufik Batisah and Rui En,7phKkEWEipo3sDrZJiG9uJ,https://youtu.be/ic3SXtPzeMQ,"At a time when hope was low
 The journey seemed unsure
 But through it all
 We've kept the flame alive
 
 Now standing proud and tall
 Our spirit strong and free
 Building on hopes and dreams
 It's here we want to be
 
 Let's reach out for the skies
 With wings we soar up high
 Our dreams we'll all achieve
 We'll make our destiny
 
 Let's reach out for the skies
 With wings we soar up high
 Our dreams we'll all achieve
 Let's soar and reach for the skies
 
 When I think about my dreams
 The future it can be
 The time has come for me
 To strive and to achieve
 
 With hopes within our hearts
 As one hand in hand
 For family and our friends
 Let's do the best we can
 
 Let's reach out for the skies
 With wings we soar up high
 Our dreams we'll all achieve
 We'll make our destiny
 
 Let's reach out for the skies
 With wings we soar up high
 Our dreams we'll all achieve
 Let's soar and reach for the skies
 
 Our dreams we'll all achieve
 Let's soar and reach for the skies
 
 We can touch the skies",
2006,My Island Home,Joshua Wan,Joshua Wan,Kaira Gong,2w5L5kQVkSRdduNewYPDA5,https://youtu.be/TLMbFYkYNyI,"This is my home
 She's everything to me
 Grace and beauty
 In all that you see
 
 My island home
 Wherever I may be
 I never will forget her
 Nor will she forget me
 
 And I will sing
 A song of home
 A land of peace
 Where dreams are born every day
 My home
 Wherever I may be
 I believe
 You will always be a part of me
 
 My island home
 Home of my family
 This is my future
 Where I want to be
 (This is my future
 This is my home)
 
 And I will sing
 A song of home
 A land of peace
 Where dreams are born every day
 My home
 Wherever I may be
 I believe
 You will always be a part of me
 
 And I will sing
 A song of home
 A land of peace
 Where dreams are born every day
 My home
 Wherever I may be
 I believe
 You will always be a part of me
 
 My home
 Wherever I may be
 I believe
 You will always be a part of me
 A part of me",
2007,There’s No Place I’d Rather Be,Jimmy Ye,Jimmy Ye,Kit Chan,2kACPmwS9MxrNCT0vcI1nP,https://youtu.be/3wXZYczZPsE,"I've walked the streets of Cairo and Bombay
 I've seen the neon signs on old Broadway
 I've climbed the Eiffel Tower
 The Great Wall in one hour
 Experienced sweet and sour but that's okay
 
 Seen Hollywood, the sunsets in LA
 The London Bridge, Big Ben, The Thames, UK
 I've crossed the River Kwai
 Yet still I don't know why
 I think of you each night and every day
 
 There's no place I'd rather be
 You'll always be a part of me
 And even though I've roamed the world
 It's still my home I long to see
 
 This is where my family
 And my friends grew up with me
 So I'll cross the skies and sail the seas
 To be where I wanna be
 
 'Cause there's no place I'd rather be",
2007,Will you,Jimmy Ye,Jimmy Ye,"Janani Sridhar, Asha Edmund, Emma Yong, Lily Ann Rahmat, Jai Wahab, Shabir Mohammed, Sebastian Tan, Gani Karim",2kACPmwS9MxrNCT0vcI1nP,https://www.youtube.com/watch?v=acin-y0AQoM,"Will you make this island
 Amazing in all ways?
 Surprises every corner
 Delightful nights and days
 
 Will you take this country
 And turn it from a place
 To a home that greets you
 With smiles on every face?
 
 Will you come on this brave journey?
 Will you help to make it real?
 Will you write us grand new stories
 Songs that everyone will feel?
 
 So will you swim the current?
 Will you scale new heights?
 Will you make it happen?
 Will you let your dreams take flight?
 
 And will you make the difference?
 Will you seize the day?
 Will you live each moment?
 Will you dare to find new ways?
 
 Will you take this city
 And turn it from a place
 To a home that greets you
 With smiles on every face?
 
 Will you come on this brave journey?
 Will you help to make it real?
 Will you write us grand new stories
 Songs that everyone will feel?
 
 So will you swim the current?
 Will you scale new heights?
 Will you make it happen?
 Will you let your dreams take flight?
 
 And will you make the difference?
 Will you seize the day?
 Will you live each moment?
 Will you dare to find new ways?",
2008,Shine for Singapore,Benny Wong,Benny Wong,Joi Chua and Hady Mirza,30QbxMta1DGgfcHUc9GfKi,https://www.youtube.com/watch?v=nSR8w0vaLXI,"Have you seen a star,
 One that guides you no matter where you are?
 However vast the sky may be
 Or dark it seems
 You can be sure, it's always there for you and me
 
 Have you heard a song,
 One that moved you, one that made you sing along?
 Your dreams and hopes will all come true
 If you believe that every vision begins with you.
 
 Shine for Singapore
 This is your song,
 Deep inside your heart where it belongs
 It'll always stay. Strive for your goals,
 You will achieve with visions so bold.
 
 Shine for Singapore
 This is our song
 Reach out for the sky, far and beyond
 As one we'll stand, we're Singapore
 It's here that we belong
 
 Have you heard a song,
 One that moved you, one that made you sing along?
 Your dreams and hopes will all come true
 If you believe that every vision begins with you.
 
 Shine for Singapore
 This is your song,
 Deep inside your heart where it belongs
 It'll always stay. Strive for your goals,
 You will achieve with visions so bold.
 
 Shine for Singapore
 This is our song
 Reach out for the sky, far and beyond
 As one we'll stand, we're Singapore
 It's here that we belong
 
 Nowhere I'd rather be, this is home to me
 This star shines strong and free",
2009,What Do You See,Electrico,Electrico,Electrico,21gm9fNWcgpWyPY3a9t7FZ,https://www.youtube.com/watch?v=GKAMTOx0nNw,"There's a jewel on the ocean,
 a gem upon the sea
 Where the future is an open book
 A land of destiny
 We could set our sights into the wind and sail the seven seas
 or climb the highest mountain top as long as we believe
 What do you see? What do you see?
 
 See the moon and the stars, look how far we have come
 Look around at our faces, they shine brightly in the sun
 With our hopes and dreams, imagine what tomorrow it may bring
 What do you see? What do you see?
 
 Now the time has come to reach out,
 To open up to see
 That we stand together in this land
 Cos we are family
 As thoughts of reaching to the sky are carried on a dream
 With hearts and minds united, our dreams we will achieve
 What do you see? What do you see?
 
 See the moon and the stars, look how far we have come
 Look around at our faces, they shine brightly in the sun
 With our hopes and dreams, imagine what tomorrow it may bring
 What do you see
 
 What do you see when life makes you take on a mountain
 Youll see that nothings gonna stand in your way
 Together we can share
 The strength of a million
 and the courage of a million more
 
 See the moon and the stars, look how far we have come
 Look around at our faces, they shine brightly in the sun
 With our hopes and dreams, imagine what tomorrow it may bring
 Cos the skys the only limit when youre not afraid to dream
 What do you see? What do you see...",
2010,Song for Singapore,Corrinne May,Corrinne May,Corrinne May,3S19ddIcYfyYhw7ZwKm58w,https://www.youtube.com/watch?v=oGY5ff831B8,"It's a brand new day a brand new story
 I remembered the way it used to be
 We've come so far
 You're my history you're my beginning
 In all I've done I've been nurtured in your arms
 And you carried me this far
 
 Chorus:
 I want to sing
 Sing a song for Singapore
 With every generation there's more to be grateful for
 
 So come and sing
 Sing a song for Singapore
 You're my brother you're my sister
 I'm thankful for my Singapore
 My Singapore
 Singapore
 
 Come together everybody
 Fly the flag and share our story
 Live our wildest dreams
 Celebrate the red and white
 The moon and stars in harmony unite
 Let every colour every heart
 
 Chorus:
 Come on and sing
 Sing a song for Singapore
 With every generation there's more to be grateful for
 
 So come and sing
 Sing a song for Singapore
 You're my brother you're my sister
 I'm thankful for my Singapore
 My Singapore
 Singapore
 
 Bridge:
 We've had our ups and downs
 Sometimes the best things are taken for granted
 You're my family you're my home
 
 Chorus:
 I want to sing
 Sing a song for Singapore
 With every generation there's more to be grateful for
 
 So come and sing
 Sing a song for Singapore
 You're my brother you're my sister
 I'm thankful for my Singapore
 My Singapore
 Singapore",
2011,In a Heartbeat,Goh Kheng Long,Haresh Sharma,Sylvia Ratonel,14dThbrteRM57dxmpV26a8,https://www.youtube.com/watch?v=VIgoiKKa9_E,"I have a dream of starting a life 
 I have a hope, a flame alight 
 This is the moment, freedom is calling 
 This is my start, a new beginning 
 
 I have a heart, it beats for you 
 A step at a time, our spirit renew 
 Living together under the sun 
 Our hearts will beat as one 
 
 In a heartbeat, I’ll be there for you 
 In a heartbeat, no one else will do 
 In a heartbeat, we will always be 
 Together, united; you and me 
 
 In a heartbeat, time has passed us by 
 In a heartbeat, we will reach the sky 
 In a heartbeat, this will always be 
 Our people, our country 
 This is our family 
 
 Nothing will stand in our way 
 We can be strong today 
 The flame is alive 
 This is our life 
 
 In a heartbeat, I’ll be there for you 
 In a heartbeat, no one else will do 
 In a heartbeat, we will always be 
 Together, united; you and me 
 
 In a heartbeat, time has passed us by 
 In a heartbeat, we will reach the sky 
 In a heartbeat, this will always be 
 Our people, our country 
 This is our family",
2012,Love at First Light,Iskandar Ismail,Paul Tan,Olivia Ong and Natanya Tan,1W5ss3pBJ3W0v8gPhbLl8C,https://www.youtube.com/watch?v=ANTvzs6Hzpc,"First light
 Rolls across my peaceful isle
 Mornings, I wake up, refreshed, renewed
 Ready to meet the bright new day
 So much to look forward to
 
 
 Daylight
 The city has stirred to life
 Your smiles
 Put a spring in my step
 There's a feeling that binds us one and all
 Different stories, shared memories
 
 Chorus I love my city's lively ways Warm sunny days Sights and sounds, special tastes That add up to this place I love my friends, my closest ties Now I finally realize When it feels this right You know that it's love at first light Night fall, stars twinkling on the bay My dreams can take flight if I dare There's a feeling that binds us one and all We look forward to a brighter day [CHORUS] Hand in hand, we'll find new strength And see our dreams take flight in Singapore [CHORUS] Where ever we roam, there's no place like home Come what may, we'll be here to stay When it feels this right You know that it's Love at first light",
2013,One Singapore,Elaine Chan,Selena Tan,Sing A Nation choir,4i0uKI1dwo2KEzLhsF8CWr,https://www.youtube.com/watch?v=AtZmmtyKS7E,"I will be here
 Right by your side, here
 I will hold near
 All that we love so dear
 Not looking elsewhere
 My life is here to share
 Just want to show I care
 
 I know we just got started
 And I’m excited
 It may not seem all perfect
 But you know what?
 Our story’s just beginnin’
 I’m gonna give it my all
 Oh yea
 
 Pre-Chorus Together we can reach for the stars (with hope in our hearts) Together we are stronger as one (let’s walk hand in hand) Together we’ll make dreams come true (won’t ever give up) Together sharing the love with all that we do Chorus Let our hearts sing Wooh ho-oh^oh! Wooh ho-oh. oh,oh! Wooh ho-oh^oh! Wooh-ho-oh-oh.oh, Together Together as one We’re so much more One Singapore [repeat] It seems like so long ago When we got started We wanted everything right But you know what Our story keeps on going We’ll give it our all [Pre-Chorus] Rap Yo! I may look like I’m just a tiny thing Here I am, I can bravely sing For sure I’m gonna give you my everything Like how I play when that recess bell rings I’m gonna give it my all Cos this is my home I love I love I love I love my Singapore [Chorus] Let’s join up the dots Light up this spot That we call home Many memories and stories to be shared Like the colours of the rainbow we will shine ever so bright Together we shine Together we shine [Chorus x 2]",
